{
  "schemaVersion": "protocol-lab.scenario-requirement-mapping.v1",
  "mappingId": "mapping.quic.transport.handshake-cold",
  "mappingVersion": "0.1.0",
  "scenarioId": "quic.transport.handshake-cold",
  "scenarioVersion": "1.0",
  "protocol": "quic",
  "catalogId": "quic-rfc9000-handshake-pilot",
  "catalogVersion": "0.1.0",
  "relationships": [
    {
      "requirementId": "REQ-QUIC-RFC9000-0271",
      "relationship": "exercises",
      "checkIds": ["handshake-completes", "fresh-session-handshake"],
      "roles": ["server"],
      "applicabilityConditions": ["The executor supplies a valid QUIC version 1 Initial packet."],
      "requiredEvidence": ["validation.json", "protocol-diagnostic-artifact"],
      "limitations": ["The existing coarse handshake check does not independently prove every condition that makes an Initial packet conforming."]
    },
    {
      "requirementId": "REQ-QUIC-RFC9000-0897",
      "relationship": "observes",
      "checkIds": ["handshake-completes", "protocol:quic"],
      "roles": ["endpoint"],
      "applicabilityConditions": ["The negotiated QUIC version is version 1."],
      "requiredEvidence": ["protocol-diagnostic-artifact"],
      "limitations": ["Handshake completion does not isolate or fully validate the TLS binding requirement."]
    }
  ],
  "reviewState": "proposed",
  "notes": "This mapping intentionally produces no directly validated requirement until check-level isolation and review exist."
}
